[
  {
    "id": "pong",
    "slug": "pong",
    "title": "Pong Classic",
    "description": "A snappy canvas remake of the arcade legend.",
    "short": "A snappy canvas remake of the arcade legend.",
    "controls": "Player 1: W/S to move. Player 2 (local) uses \u2191/\u2193. Press Space to pause or resume.",
    "tags": [
      "classic",
      "2D"
    ],
    "engineType": "canvas-2d",
    "difficulty": "easy",
    "released": "2025-08-20",
    "playUrl": "/games/pong/",
    "version": "1.0.0",
    "thumbnailPath": "/games/pong/thumb.svg",
    "thumbnail": "/games/pong/thumb.svg",
    "assets": {
      "sprites": [
        "/assets/sprites/paddle.png",
        "/assets/sprites/ball.png"
      ],
      "audio": [
        "/assets/audio/hit.wav",
        "/assets/audio/powerup.wav",
        "/assets/audio/click.wav"
      ]
    },
    "firstFrame": {
      "sprites": [
        "/assets/sprites/paddle.png",
        "/assets/sprites/ball.png"
      ],
      "audio": [
        "/assets/audio/hit.wav",
        "/assets/audio/powerup.wav",
        "/assets/audio/click.wav"
      ]
    },
    "featureFlags": [
      "AI",
      "Touch",
      "Keybinds",
      "Gamepad",
      "SFX",
      "Diagnostics"
    ],
    "minDevice": {
      "width": 360,
      "height": 200
    },
    "help": {
      "objective": "Win rallies until you reach 11 points before your opponent.",
      "controls": "Player 1: W/S to move. Player 2 (local) uses \u2191/\u2193. Press Space to pause or resume.",
      "tips": [
        "Angle the paddle to change the ball's direction and catch opponents off guard.",
        "Stay near the center between shots so you can react to either corner.",
        "Use quick taps instead of holding a direction to avoid overshooting the ball."
      ],
      "steps": [
        "Watch the opening serve and get your paddle in position immediately.",
        "Return the ball past the opposite paddle to score a point.",
        "Reach 11 points first to win the match."
      ]
    }
  },
  {
    "id": "snake",
    "slug": "snake",
    "title": "Snake",
    "description": "Eat, grow, don't bonk into yourself.",
    "short": "Eat, grow, don't bonk into yourself.",
    "controls": "Use Arrow keys or WASD to steer. Press P to pause and R to restart.",
    "tags": [
      "classic",
      "2D"
    ],
    "engineType": "canvas-2d",
    "difficulty": "easy",
    "released": "2025-08-25",
    "playUrl": "/games/snake/",
    "version": "1.0.0",
    "thumbnailPath": "/games/snake/thumb.svg",
    "thumbnail": "/games/snake/thumb.svg",
    "assets": {
      "sprites": [
        "/assets/sprites/coin.png"
      ],
      "audio": [
        "/assets/audio/hit.wav",
        "/assets/audio/powerup.wav",
        "/assets/audio/click.wav"
      ]
    },
    "firstFrame": {
      "sprites": [
        "/assets/sprites/coin.png"
      ],
      "audio": [
        "/assets/audio/hit.wav",
        "/assets/audio/powerup.wav",
        "/assets/audio/click.wav"
      ]
    },
    "featureFlags": [
      "Offline",
      "Touch"
    ],
    "minDevice": {
      "width": 320,
      "height": 200
    },
    "help": {
      "objective": "Grow the snake by eating fruit without crashing into walls or your tail.",
      "controls": "Use Arrow keys or WASD to steer. Press P to pause and R to restart.",
      "tips": [
        "Plan turns a few squares ahead to keep open lanes for future moves.",
        "Sweep the perimeter to straighten the snake before going for tight snacks.",
        "Avoid reversing direction directly\u2014turn in an arc to stay safe."
      ],
      "steps": [
        "Press an arrow key to start moving.",
        "Guide the snake to each glowing pellet to grow and score.",
        "Keep moving without colliding with obstacles or yourself to continue the run."
      ]
    }
  },
  {
    "id": "tetris",
    "slug": "tetris",
    "title": "Tetris",
    "description": "Classic falling blocks. Clear lines, level up.",
    "short": "Classic falling blocks. Clear lines, level up.",
    "controls": "\u2190/\u2192 move, \u2191 rotate, \u2193 soft drop, Space hard drop, P pause.",
    "tags": [
      "classic",
      "2D"
    ],
    "engineType": "canvas-2d",
    "difficulty": "medium",
    "released": "2025-08-26",
    "playUrl": "/games/tetris/",
    "version": "1.0.0",
    "thumbnailPath": "/games/tetris/thumb.svg",
    "thumbnail": "/games/tetris/thumb.svg",
    "assets": {
      "sprites": [
        "/assets/sprites/block.png",
        "/assets/backgrounds/arcade.png",
        "/assets/effects/spark.png",
        "/assets/effects/explosion.png"
      ],
      "audio": [
        "/assets/audio/hit.wav",
        "/assets/audio/powerup.wav",
        "/assets/audio/click.wav"
      ]
    },
    "firstFrame": {
      "sprites": [
        "/assets/sprites/block.png",
        "/assets/backgrounds/arcade.png",
        "/assets/effects/spark.png",
        "/assets/effects/explosion.png"
      ],
      "audio": [
        "/assets/audio/hit.wav",
        "/assets/audio/powerup.wav",
        "/assets/audio/click.wav"
      ]
    },
    "featureFlags": [
      "Offline",
      "Keyboard"
    ],
    "minDevice": {
      "width": 320,
      "height": 200
    },
    "help": {
      "objective": "Clear horizontal lines by stacking falling tetrominoes without topping out.",
      "controls": "\u2190/\u2192 move, \u2191 rotate, \u2193 soft drop, Space hard drop, P pause.",
      "tips": [
        "Leave a clean lane on one side so I pieces can score Tetrises.",
        "Soft drop to adjust a piece before committing to a hard drop.",
        "Rotate pieces before they reach the stack to avoid last-second scrambles."
      ],
      "steps": [
        "Start the game and study the upcoming queue.",
        "Slide and rotate each piece into the best fit as it falls.",
        "Clear lines to speed up and push for high scores."
      ]
    }
  },
  {
    "id": "breakout",
    "slug": "breakout",
    "title": "Breakout",
    "description": "Smash bricks, power-ups, chase the score.",
    "short": "Smash bricks, power-ups, chase the score.",
    "controls": "Move the paddle with the mouse or \u2190/\u2192 keys. Click/tap to launch. P pauses, R restarts after a loss.",
    "tags": [
      "classic",
      "2D"
    ],
    "engineType": "canvas-2d",
    "difficulty": "medium",
    "released": "2025-08-26",
    "playUrl": "/games/breakout/",
    "version": "1.0.0",
    "thumbnailPath": "/games/breakout/thumb.svg",
    "thumbnail": "/games/breakout/thumb.svg",
    "assets": {
      "sprites": [
        "/assets/sprites/paddle.png",
        "/assets/sprites/brick.png",
        "/assets/sprites/ball.png"
      ],
      "audio": [
        "/assets/audio/hit.wav",
        "/assets/audio/powerup.wav",
        "/assets/audio/click.wav"
      ]
    },
    "firstFrame": {
      "sprites": [
        "/assets/sprites/paddle.png",
        "/assets/sprites/brick.png",
        "/assets/sprites/ball.png"
      ],
      "audio": [
        "/assets/audio/hit.wav",
        "/assets/audio/powerup.wav",
        "/assets/audio/click.wav"
      ]
    },
    "featureFlags": [
      "Offline",
      "Mouse",
      "Touch"
    ],
    "minDevice": {
      "width": 320,
      "height": 200
    },
    "help": {
      "objective": "Break every brick on the stage while protecting your remaining lives.",
      "controls": "Move the paddle with the mouse or \u2190/\u2192 keys. Click/tap to launch. P pauses, R restarts after a loss.",
      "tips": [
        "Catch falling power-ups to widen the paddle or add extra balls.",
        "Hit the ball off-center to steer shots into hard-to-reach bricks.",
        "Stay beneath clusters of bricks so ricochets keep clearing rows."
      ],
      "steps": [
        "Line up the paddle and launch the opening serve.",
        "Deflect the ball back into the brick wall to clear tiles and score.",
        "Finish each layout before running out of lives to advance."
      ]
    }
  },
  {
    "id": "chess",
    "slug": "chess",
    "title": "Chess (2D)",
    "description": "Traditional chess for two players.",
    "short": "Traditional chess for two players.",
    "controls": "Click or tap a piece, then select a highlighted square to move. Use on-screen options for puzzles, difficulty, and remapping.",
    "tags": [
      "classic",
      "board"
    ],
    "engineType": "canvas-2d",
    "difficulty": "hard",
    "released": "2025-08-20",
    "playUrl": "/games/chess/",
    "version": "1.0.0",
    "thumbnailPath": "/games/chess/thumb.svg",
    "thumbnail": "/games/chess/thumb.svg",
    "assets": {
      "sprites": [
        "/assets/ui/panel.png",
        "/assets/ui/star.png"
      ],
      "audio": [
        "/assets/audio/click.wav"
      ]
    },
    "firstFrame": {
      "sprites": [
        "/assets/ui/panel.png",
        "/assets/ui/star.png"
      ],
      "audio": [
        "/assets/audio/click.wav"
      ]
    },
    "featureFlags": [
      "Offline",
      "Two Player"
    ],
    "minDevice": {
      "width": 360,
      "height": 240
    },
    "help": {
      "objective": "Checkmate the opposing king using standard chess rules.",
      "controls": "Click or tap a piece, then select a highlighted square to move. Use on-screen options for puzzles, difficulty, and remapping.",
      "tips": [
        "Control the center early so your pieces have maximum reach.",
        "Castle before your king comes under pressure.",
        "Look for tactics after every move\u2014forks, pins, and discovered attacks."
      ],
      "steps": [
        "Choose a difficulty or puzzle, then make the first move.",
        "Develop pieces, protect your king, and coordinate attacks.",
        "Deliver checkmate or win by opponent resignation to finish the game."
      ]
    }
  },
  {
    "id": "chess3d",
    "slug": "chess3d",
    "title": "Chess 3D (Local)",
    "description": "A three-dimensional chess experiment.",